<?xml version="1.0" encoding="UTF-8"?>
<xs:schema xmlns:xs="http://www.w3.org/2001/XMLSchema" elementFormDefault="qualified"
    targetNamespace="http://www.ftn.uns.ac.rs/xwt" xmlns:zah="http://www.ftn.uns.ac.rs/xwt">

    <xs:element name="zahtev">
        <xs:complexType>
            <xs:sequence>
                <xs:element name="prijava" type="zah:TPrijava"/>
                <xs:element name="podnosilac" type="zah:TPodnosilac"/>
                <xs:element minOccurs="0" name="punomocnik" type="zah:TLice"/>
                <xs:element name="autorsko_delo" type="zah:TAutorskoDelo"/>
                <xs:element name="prilozi">
                    <xs:complexType>
                        <xs:sequence>
                            <xs:element maxOccurs="unbounded" name="prilog" type="zah:TPrilog"/>
                        </xs:sequence>
                    </xs:complexType>
                </xs:element>
                <xs:element name="zavod" type="zah:TZavod"/>
            </xs:sequence>
        </xs:complexType>
    </xs:element>
    <xs:complexType abstract="true" name="TLice">
        <xs:sequence>
            <xs:element name="kontakt" type="zah:TKontakt"/>
        </xs:sequence>
    </xs:complexType>
    <xs:complexType name="TPrijava">
        <xs:sequence>
            <xs:element name="broj_prijave" type="xs:positiveInteger"/>
            <xs:element name="datum_podnosenja" type="xs:date"/>
        </xs:sequence>
    </xs:complexType>
    <xs:complexType name="TFizickoLice">
        <xs:complexContent>
            <xs:extension base="zah:TLice">
                <xs:sequence>
                    <xs:element name="ime" type="xs:string"/>
                    <xs:element name="prezime" type="xs:string"/>
                    <xs:element name="adresa" type="zah:TAdresa"/>
                    <xs:element name="drzavljanstvo" type="xs:string"/>
                </xs:sequence>
            </xs:extension>
        </xs:complexContent>
    </xs:complexType>
    <xs:complexType name="TPravnoLice">
        <xs:complexContent>
            <xs:extension base="zah:TLice">
                <xs:sequence>
                    <xs:element name="poslovno_ime" type="xs:string"/>
                    <xs:element name="sediste" type="xs:string"/>
                </xs:sequence>
            </xs:extension>
        </xs:complexContent>
    </xs:complexType>
    <xs:complexType name="TAutorskoDelo">
        <xs:sequence>
            <xs:element name="naslov" type="xs:string"/>
            <xs:element name="delo_prerade" type="zah:TDeloPrerade"/>
            <xs:element name="vrsta_dela" type="xs:string"/>
            <xs:element name="forma_zapisa_dela" type="xs:string"/>
            <xs:element name="stvoreno_u_radnom_odnosu">
                <xs:simpleType>
                    <xs:restriction base="xs:boolean"> </xs:restriction>
                </xs:simpleType>
            </xs:element>
            <xs:element name="nacin_koriscenja" type="xs:string"/>
            <xs:element minOccurs="0" name="autori">
                <xs:complexType>
                    <xs:sequence>
                        <xs:element form="qualified" maxOccurs="unbounded" name="autor"
                            type="zah:TAutor"/>
                    </xs:sequence>
                </xs:complexType>
            </xs:element>
            <xs:element name="anoniman_autor">
                <xs:simpleType>
                    <xs:restriction base="xs:boolean"> </xs:restriction>
                </xs:simpleType>
            </xs:element>
        </xs:sequence>
    </xs:complexType>
    <xs:complexType name="TDeloPrerade">
        <xs:sequence>
            <xs:element name="naslov_dela_prerade" type="xs:string"/>
            <xs:element name="autori" minOccurs="0">
                <xs:complexType>
                    <xs:sequence>
                        <xs:element maxOccurs="unbounded" name="autor" type="zah:TAutor"/>
                    </xs:sequence>
                </xs:complexType>
            </xs:element>
        </xs:sequence>
    </xs:complexType>
    <xs:complexType name="TAutor">
        <xs:complexContent>
            <xs:extension base="zah:TFizickoLice">
                <xs:sequence>
                    <xs:element name="pseudonim" type="xs:string" minOccurs="0"/>
                </xs:sequence>
            </xs:extension>
        </xs:complexContent>
    </xs:complexType>
    <xs:complexType name="TAdresa">
        <xs:all>
            <xs:element name="ulica" type="xs:string"/>
            <xs:element name="broj" type="xs:positiveInteger"/>
            <xs:element name="postanski_broj">
                <xs:simpleType>
                    <xs:restriction base="xs:int">
                        <xs:minInclusive value="11000"/>
                        <xs:maxInclusive value="40000"/>
                    </xs:restriction>
                </xs:simpleType>
            </xs:element>
            <xs:element name="mesto" type="xs:string"/>
            <xs:element name="drzava" type="xs:string"/>
        </xs:all>
    </xs:complexType>
    <xs:complexType name="TPrilog">
        <xs:attribute name="vrsta_priloga"/>
        <xs:attribute name="src"/>
    </xs:complexType>
    <xs:complexType name="TKontakt">
        <xs:all>
            <xs:element name="telefon" type="xs:string"/>
            <xs:element name="email" type="xs:string"/>
            <xs:element minOccurs="0" name="fax" type="xs:string"/>
        </xs:all>
    </xs:complexType>
    <xs:complexType name="TZavod">
        <xs:sequence>
            <xs:element name="naziv" type="xs:string"/>
            <xs:element name="adresa" type="zah:TAdresa"/>
        </xs:sequence>
    </xs:complexType>
    <xs:complexType name="TPodnosilac">
        <xs:sequence>
            <xs:element name="lice" type="zah:TLice"/>
        </xs:sequence>
        <xs:attribute name="podnosilac_je_autor" type="xs:boolean"> </xs:attribute>
    </xs:complexType>
</xs:schema>
