<?xml version="1.0" encoding="UTF-8" standalone="no"?>
<?xml-stylesheet type="text/xsl" href="xslt.xsl"?>
<zahtev xmlns="http://www.ftn.uns.ac.rs/xwt"
    xmlns:xsi="http://www.w3.org/2001/XMLSchema-instance"
    xsi:schemaLocation="http://www.ftn.uns.ac.rs/xwt A-1.xsd">
    <prijava>
        <broj_prijave>12</broj_prijave>
        <datum_podnosenja>2022-12-15</datum_podnosenja>
    </prijava>
    <podnosilac podnosilac_je_autor="true">
        <lice xsi:type="TFizickoLice">
            <kontakt>
                <telefon>0628977742</telefon>
                <email>dd@gmail.com</email>
            </kontakt>
            <ime>Dragan</ime>
            <prezime>Dragic</prezime>
            <adresa>
                <ulica>Bul. oslobođenja</ulica>
                <broj>25</broj>
                <postanski_broj>21211</postanski_broj>
                <mesto>Novi Sad</mesto>
                <drzava>Srbija</drzava>
            </adresa>
            <drzavljanstvo>Srpsko</drzavljanstvo>
        </lice>
    </podnosilac>
    <autorsko_delo>
        <naslov>Nova knjiga</naslov>
        <delo_prerade>
            <naslov_dela_prerade>Stara knjiga</naslov_dela_prerade>
            <autori>
                <autor>
                    <kontakt>
                        <telefon>0632153945</telefon>
                        <email>pera@gmail.com</email>
                    </kontakt>
                    <ime>Pera</ime>
                    <prezime>Peric</prezime>
                    <adresa>
                        <ulica>Miše Dimitrijevića</ulica>
                        <broj>54</broj>
                        <postanski_broj>21000</postanski_broj>
                        <mesto>Novi Sad</mesto>
                        <drzava>Srbija</drzava>
                    </adresa>
                    <drzavljanstvo>Srpsko</drzavljanstvo>
                </autor>
            </autori>
        </delo_prerade>
        <vrsta_dela>književno delo</vrsta_dela>
        <forma_zapisa_dela>štampani tekst</forma_zapisa_dela>
        <stvoreno_u_radnom_odnosu>true</stvoreno_u_radnom_odnosu>
        <nacin_koriscenja></nacin_koriscenja>
        <autori>
            <autor>
                <kontakt>
                    <telefon>0628977742</telefon>
                    <email>dd@gmail.com</email>
                </kontakt>
                <ime>Dragan</ime>
                <prezime>Dragic</prezime>
                <adresa>
                    <ulica>Bul. oslobođenja</ulica>
                    <broj>24</broj>
                    <postanski_broj>21211</postanski_broj>
                    <mesto>Novi Sad</mesto>
                    <drzava>Srbija</drzava>
                </adresa>
                <drzavljanstvo>Srpsko</drzavljanstvo>
                <pseudonim>Dragi</pseudonim>
            </autor>
        </autori>
        <anoniman_autor>false</anoniman_autor>
    </autorsko_delo>
    <prilozi>
        <prilog vrsta_priloga="opis autorskog dela" src="Putanja do opisa"/>
    </prilozi>
    <zavod>
        <naziv>Zavod za intelektualnu svojinu</naziv>
        <adresa>
            <ulica>Kneginje Ljubice</ulica>
            <broj>5</broj>
            <postanski_broj>11000</postanski_broj>
            <mesto>Beograd</mesto>
            <drzava>Srbija</drzava>
        </adresa>
    </zavod>
</zahtev>