<?xml version="1.0" encoding="UTF-8"?>
<zahtev xmlns="http://www.ftn.uns.ac.rs/xwt"
    xmlns:xsi="http://www.w3.org/2001/XMLSchema-instance"
    xsi:schemaLocation="http://www.ftn.uns.ac.rs/xwt A-1.xsd">
    <prijava>
        <broj_prijave>12</broj_prijave>
        <datum_podnosenja>2022-12-15</datum_podnosenja>
    </prijava>
    <podnosilac>
        <lice xsi:type="TFizickoLice">
            <kontakt>
                <telefon></telefon>
                <email></email>
            </kontakt>
            <ime>Mihal</ime>
            <prezime></prezime>
            <drzavljanstvo></drzavljanstvo>
        </lice>
    </podnosilac>
    <autorsko_delo>
        <naslov></naslov>
        <delo_prerade>
            <naslov_dela_prerade></naslov_dela_prerade>
        </delo_prerade>
        <vrsta_dela></vrsta_dela>
        <forma_zapisa_dela></forma_zapisa_dela>
        <stvoreno_u_radnom_odnosu>true</stvoreno_u_radnom_odnosu>
        <nacin_koriscenja></nacin_koriscenja>
        <anoniman_autor>false</anoniman_autor>
    </autorsko_delo>
    <prilozi>
        <prilog/>
    </prilozi>
    <zavod>
        <naziv></naziv>
        <adresa>
            <ulica></ulica>
            <broj>15</broj>
            <postanski_broj>21000</postanski_broj>
            <mesto></mesto>
            <drzava></drzava>
        </adresa>
    </zavod>
</zahtev>